{
  "$schema": "https://json-schema.org/draft/2020-12/schema",
  "$id": "https://ximicpp.github.io/TypeLayout/layout-observer/0.1/compare-manifest.schema.json",
  "title": "Layout Compare compare-manifest 0.1",
  "type": "object",
  "properties": {
    "schemaVersion": {
      "const": "0.1"
    },
    "mode": {
      "enum": [
        "regression",
        "representation",
        "marshaled-layout"
      ]
    },
    "policy": {
      "enum": [
        "value-fields-v1",
        "value-alignment-v1"
      ]
    },
    "scope": {
      "enum": [
        "value",
        "array",
        "object"
      ]
    },
    "cases": {
      "type": "array",
      "items": {
        "type": "object",
        "properties": {
          "id": {
            "type": "string",
            "minLength": 1
          },
          "left": {
            "type": "string",
            "minLength": 1
          },
          "right": {
            "type": "string",
            "minLength": 1
          },
          "fields": {
            "type": "array",
            "items": {
              "$ref": "#/$defs/fieldMap"
            }
          }
        },
        "required": [
          "id",
          "left",
          "right"
        ],
        "additionalProperties": false
      },
      "minItems": 1
    }
  },
  "required": [
    "schemaVersion",
    "mode",
    "policy",
    "scope",
    "cases"
  ],
  "additionalProperties": false,
  "allOf": [
    {
      "if": {
        "properties": {
          "mode": {
            "enum": [
              "representation",
              "marshaled-layout"
            ]
          }
        }
      },
      "then": {
        "properties": {
          "cases": {
            "items": {
              "required": [
                "fields"
              ]
            }
          }
        }
      }
    }
  ],
  "$defs": {
    "fieldMap": {
      "type": "object",
      "properties": {
        "id": {
          "type": "string",
          "minLength": 1
        },
        "left": {
          "type": "string",
          "minLength": 1
        },
        "right": {
          "type": "string",
          "minLength": 1
        },
        "children": {
          "type": "array",
          "items": {
            "$ref": "#/$defs/fieldMap"
          }
        }
      },
      "required": [
        "id",
        "left",
        "right"
      ],
      "additionalProperties": false
    }
  }
}
